{
    "apiVersion": 3,
    "name": "acf/apartment-list",
    "title": "Apartment List",
    "description": null,
    "category": "theme",
    "icon": "<svg xmlns=\"http://www.w3.org/2000/svg\" fill=\"none\" viewBox=\"0 0 32 32\"><g clip-path=\"url(#clip0_424_584)\"><path fill=\"currentColor\" d=\"M5 7h22v19H5z\"/><g fill=\"currentColor\" clip-path=\"url(#clip1_424_584)\"><path d=\"M16 0C7.163 0 0 7.163 0 16s7.163 16 16 16 16-7.163 16-16S24.837 0 16 0Zm9.768 16.887c-.076 1.868-.792 3.552-1.903 4.79-1.106 1.234-2.639 2.035-4.313 2.037a4.938 4.938 0 0 1-3.047-1.036 6.209 6.209 0 0 1-1.065-1.048 9.41 9.41 0 0 1-.868.714c-.937.675-2.035 1.17-3.27 1.286a5.478 5.478 0 0 1-.51.024 4.42 4.42 0 0 1-2.002-.458 4.235 4.235 0 0 1-1.458-1.221c-.761-1.001-1.11-2.27-1.111-3.554 0-.285.018-.573.053-.86a12.601 12.601 0 0 1 1.557-4.766c.858-1.52 2.076-2.982 3.718-4.506l1.233 1.33c-1.547 1.433-2.632 2.755-3.374 4.067-.742 1.313-1.151 2.623-1.334 4.097a5.265 5.265 0 0 0-.04.637c0 .714.153 1.399.427 1.948.277.552.659.96 1.146 1.208.328.165.71.263 1.184.264.109 0 .22-.005.337-.016.859-.083 1.644-.423 2.383-.952a7.83 7.83 0 0 0 .952-.82c-.628-1.33-.964-2.876-.965-4.46 0-.541.039-1.085.121-1.628.157-1.04.49-1.973.936-2.752.449-.777 1.01-1.409 1.678-1.82.446-.272.95-.447 1.487-.449a2.514 2.514 0 0 1 1.348.394c.294.191.537.447.712.73.353.572.468 1.222.47 1.89-.003.96-.246 2-.645 3.036a23.234 23.234 0 0 1-1.726 3.551 16.83 16.83 0 0 1-1.196 1.733c.279.384.588.708.917.96a3.12 3.12 0 0 0 1.947.665c1.082 0 2.14-.52 2.965-1.437.823-.913 1.383-2.206 1.44-3.65.007-.164.01-.326.01-.488.01-3.603-1.61-6.937-1.69-7.08v-.004l1.614-.824c.026.066 1.879 3.653 1.89 7.908 0 .186-.003.373-.011.562l.003-.002Z\"/><path d=\"M17.918 14.337c.34-.878.525-1.741.524-2.383 0-.335-.05-.604-.12-.779-.073-.178-.146-.259-.237-.319a.694.694 0 0 0-.278-.095l-.086-.007c-.135 0-.318.045-.54.181a2.748 2.748 0 0 0-.709.665c-.478.609-.894 1.537-1.06 2.635-.067.448-.1.903-.1 1.355 0 1.003.166 1.992.464 2.872 1.04-1.495 1.768-3.152 2.142-4.125Z\"/></g></g><defs><clipPath id=\"clip0_424_584\"><path fill=\"currentColor\" d=\"M0 0h32v32H0z\"/></clipPath><clipPath id=\"clip1_424_584\"><path fill=\"currentColor\" d=\"M0 0h32v32H0z\"/></clipPath></defs></svg>",
    "keywords": null,
    "supports": {
        "align": [
            "full"
        ],
        "mode": false,
        "spacing": false,
        "anchor": true,
        "className": true
    },
    "attributes": {
        "align": {
            "type": "string",
            "default": "full"
        }
    },
    "example": {
        "viewportWidth": 1280,
        "attributes": {
            "align": "full",
            "mode": "preview",
            "data": {
                "title": "Augustin",
                "venues": [
                    "Augustin",
                    "Pellico Garden"
                ],
                "booking_url": "/page/booking",
                "links": [
                    {
                        "link": {
                            "title": "Pick from a 3D Plan",
                            "url": "/page/augustin-map"
                        },
                        "title_short": "3D Plan",
                        "icon": "plan-3d",
                        "active": false
                    },
                    {
                        "link": {
                            "title": "Pick from a list",
                            "url": "/page/augustin-list"
                        },
                        "title_short": "List",
                        "icon": "list",
                        "active": true
                    }
                ],
                "items": [
                    {
                        "number": "A.149",
                        "layout": "1kk",
                        "floor": "1",
                        "orientation": "D",
                        "style": "marrakech",
                        "price": 19700,
                        "price_eur": 780,
                        "status": "available",
                        "available_from_date": "",
                        "venue": "Augustin",
                        "length_of_stay": "long",
                        "detail_url": "/page/flat-full"
                    },
                    {
                        "number": "A.150",
                        "layout": "2kk",
                        "floor": "2",
                        "orientation": "U",
                        "style": "rose",
                        "price": 25700,
                        "price_eur": 1020,
                        "status": "unavailable",
                        "available_from_date": "",
                        "venue": "Pellico Garden",
                        "length_of_stay": "short",
                        "detail_url": "/page/flat-full"
                    }
                ]
            }
        }
    },
    "acf": {
        "mode": "preview",
        "renderCallback": "timber_block_render_callback",
        "postTypes": [
            "page",
            "building",
            "room_type",
            "flat"
        ]
    }
}
